"Main_Headline","Date"
"Honda’s Hybrid Do-Over","2014-01-10T21:47:42+0000"
"Honda’s Hatch, More Fit for the Task","2014-01-14T00:22:35+0000"
"Honda Introduces Honda 2015 Fit","2014-01-14T15:01:15+0000"
"Honda Recalls 900,000 Minivans","2014-03-15T22:28:27+0000"
"Wheelies: The 20 Million Hondas Edition","2014-03-22T01:05:45+0000"
"A Quick, Satisfying Drive in the 2015 Honda Fit","2014-04-17T00:37:24+0000"
"Honda HR-V: The Fit as a Crossover","2014-04-17T20:44:54+0000"
"Honda Recalls 25,000 Odyssey Minivans for Air Bag Defect","2014-05-02T15:43:49+0000"
"Chrysler and Honda Issue Recalls","2014-06-09T20:18:00+0000"
"The 2015 Honda Fit: More Than Skin Deep","2014-06-13T20:53:13+0000"
"Wheelies: The Flying Honda Edition","2014-07-01T15:51:54+0000"
"Honda Expands Takata Air Bag Inflator Recall","2014-07-08T22:45:05+0000"
"N.H.T.S.A. Deepens Investigation of Honda Accord Air Bags","2014-08-18T19:57:01+0000"
"2015 Honda Fit Gets Second Chance in I.I.H.S. Crash Test","2014-08-21T15:15:46+0000"
"Honda Recalls 126,000 GL 1800 Motorcycles","2014-09-08T17:26:47+0000"
"Air Bag Flaw, Long Known to Honda and Takata, Led to Recalls","2014-09-12T03:30:23+0000"
"Air-Bag Investigation: The View From Honda","2014-09-15T21:11:45+0000"
"Honda’s Sensible Starting Point ","2014-10-17T20:50:00+0000"
"Investigation of Honda Centers on Failure to Report Deaths From Takata Airbags","2014-11-04T01:47:20+0000"
"Wheelies: The Duality of Honda Edition","2014-11-11T19:42:57+0000"
"New Recall by Honda After Death in Malaysia Is Tied to Takata Airbag","2014-11-13T07:55:40+0000"
"Volkswagen Recalls 400 Cars, and N.H.T.S.A. Investigates Honda and Infiniti","2014-11-17T17:09:17+0000"
"Honda to Replace Airbags Throughout U.S.","2014-11-18T05:04:15+0000"
"Honda Failed to Report Defects’ Full Human Toll","2014-11-25T01:58:34+0000"
"Honda to Expand Airbag Recall Nationwide as Takata Resists","2014-12-03T15:03:09+0000"
"Takata and Honda Officials Testify","2014-12-03T21:06:34+0000"
"Honda Collection Hall Showcases Soichiro Honda’s Dreams","2014-12-10T20:35:24+0000"
"Less Is More With the 2014 Honda CBR650F","2014-12-16T21:24:31+0000"
"Driven | 2015 Honda Fit","2014-12-17T19:52:09+0000"
"Video: The Honda Fit Still Packs a Lot Into a Small Space","2014-12-17T20:03:48+0000"
"Honda Fined for Violations of Safety Law","2015-01-08T17:54:57+0000"
"Honda Motors Fined a Record Amount, but It’s Still Just a Rounding Error","2015-01-08T20:54:44+0000"
"Honda in Japan Distances Itself From Fine on U.S. Subsidiary ","2015-01-09T09:10:52+0000"
"Honda Introduces Vehicle Powered by Hydrogen","2015-01-14T01:38:58+0000"
"Honda Cuts Profit Forecast for Year as It Deals With Recalls","2015-01-30T09:42:18+0000"
"Honda, Grappling With Quality Problems, Will Replace Its President","2015-02-23T12:58:12+0000"
"Practicing in the Dark, Some Early Starters Grumble at the Honda Classic","2015-02-27T02:45:22+0000"
"First for Ian Poulter Fades Quickly at Delayed Honda Classic","2015-03-02T03:04:22+0000"
"Honda, to Hasten Takata Airbag Fixes, Turns to Ad Campaign","2015-03-12T21:17:09+0000"
"Honda Expands Takata Airbag-Related Recalls","2015-03-19T23:18:44+0000"
"Honda Recalls Nearly 5 Million Vehicles With Takata Airbags","2015-05-14T13:35:27+0000"
"Driven | 2016 Honda HR-V","2015-05-19T17:35:29+0000"
"Video Review: The Honda CR-V Gets a Little Brother, the HR-V","2015-05-19T18:09:45+0000"
"Honda Links a Rupturing Takata Airbag to a 7th Death","2015-06-12T23:23:16+0000"
"Airbag Death in Honda Rental Car Reveals a Gap","2015-06-20T00:01:12+0000"
"Honda Recalls 4.5 Million More Vehicles Over Takata Airbags","2015-07-09T08:54:26+0000"
"Driven | 2015 Honda Accord Hybrid","2015-07-29T18:16:30+0000"
"Video Review: Honda Takes Different Path With the Accord Hybrid","2015-07-29T18:16:32+0000"
"Takata and Honda Kept Quiet on Study That Questioned Airbag Propellant","2015-10-21T08:59:39+0000"
"Honda to Recall 300,000 Accords for Airbag Problem","2015-10-30T00:29:13+0000"
"Honda Drops Takata as U.S. Issues Huge Fine Over Airbags","2015-11-03T19:08:58+0000"
"In Honda’s Rebuke of Takata, a Rare Move for Business Partners in Japan","2015-11-04T15:10:12+0000"
"Honda and Takata Officials React","2015-11-04T17:36:41+0000"
"Video Review: Honda Pilot Is Useful Like a Van, but No Longer Square","2015-12-02T16:49:48+0000"
"Honda and Takata Discussed Faulty Airbag at 2009 Meeting","2015-12-23T18:04:54+0000"
"Honda Expands Recall of Takata Airbags as Its Longtime Partner’s Crisis Widens","2016-02-04T01:52:03+0000"
"Brandishing a Short Putter, a Relieved Adam Scott Wins the Honda Classic","2016-02-29T02:34:58+0000"
"Video Review: The Honda Civic Touring Is Packed With Technology and Space","2016-03-24T13:10:04+0000"
"Honda Expands Takata Airbag Recall","2016-05-13T13:16:07+0000"
"U.S. Warns Honda and Acura Owners to Replace Airbags","2016-06-30T18:38:44+0000"
"Video Review: Honda Ridgeline, a Stylish Pickup for the Suburbs","2016-07-14T13:05:56+0000"
"Out of Africa, an All-Road Honda Motorcycle","2016-12-01T23:19:47+0000"
"Driven | 2017 Honda CR-V Touring","2017-01-26T16:39:37+0000"
"Video Review: The 2017 Honda CR-V Stays True to Its Mainstream Roots","2017-01-26T16:39:39+0000"
"Driven | Honda Civic Hatchback Sport","2017-02-16T14:58:54+0000"
"Video Review: The Honda Civic Is Back as a Hatchback","2017-02-16T15:02:41+0000"
"Rickie Fowler Weathers a Storm to Win the Honda Classic","2017-02-27T01:14:37+0000"
"Takata Airbag Blamed for a Death in a Honda Being Repaired","2017-07-11T00:38:52+0000"
"Honda Recalls 800,000 Odyssey Minivans Because of Seat Latches","2017-11-19T01:16:34+0000"
"Tiger Woods’s Comeback Gains Steam at Honda Classic","2018-02-26T03:00:56+0000"
"Honda Putting $2.75 Billion Into G.M.’s Self-Driving Venture","2018-10-03T12:44:34+0000"
"Honda Confirms Plan to Leave Britain as Brexit Looms","2019-02-18T20:07:30+0000"
"I Wanted a Mobile Art Studio. So I Built One, in the Back of a Honda.","2019-05-16T15:46:44+0000"
"Sungjae Im Gets First PGA Tour Win at Honda Classic","2020-03-01T23:56:22+0000"
"Honda Hackers May Have Used Tools Favored by Countries","2020-06-12T19:17:33+0000"
"Sony and Honda Announce Tie-Up to Make Electric Cars","2022-03-04T10:09:45+0000"
"Honda and LG will jointly build a U.S. battery plant.","2022-08-29T14:31:44+0000"
"U.A.W. Accuses Honda, Hyundai and Volkswagen of Labor Violations","2023-12-11T20:50:38+0000"
